id,sentence,price,quality,environment,service,other
1403.0,overrated place ,,,,,Negative
1403.0,it s a disappointment and below par as per taste ,,Negative,,,
1403.0,we had panok prawns  you could taste the batter  it s basically the deep fried prawns however the taste is not at al upto the mark ,,Negative,,,
1403.0,schewan noddles and chicken garlic sauce is below par ,,Negative,,,
1403.0,nothing great about the place ,,,,,Negative
1404.0,the ambinence was good but the food was nt that much of good which i expected from them  ,,Negative,Positive,,
1404.0,the staff was rude and nt proffesional  ,,,,Negative,
1404.0,worst experience that i ever had in my life,,,,,Negative
1405.0,below average restaurant food is not that good most people go there for buffet they served cheap welcome drink which infected my throat thats,,Negative,,,
1406.0,i ordered corn fry magi which came overfried   and the other order double egg and double chicken magi is also not that good     ,,Negative,,,
1407.0,size is small,,Negative,,,
1408.0,naan is not gud    ,,Negative,,,
1409.0,have been to lunch with friends here today  first things  ambiance seems to be pretty good  i think people just carried on ambiance for this location ,,,Positive,,
1409.0,serving is damn slow  even though not much of crowd in the restaurant ,,,,Negative,
1409.0,price is pretty on a higher side  virgin mojito just tasted as mint lemon drink ,Negative,Negative,,,
1409.0,we need to ask several times to serve  also when we for main course figured out that few dishes were not served to us which were part of starters  when asked  the same was brought later  welcome drink is the one which is served after several remainders and tasted bad ,,Negative,,Negative,
1409.0,desserts were not so great and not many ,,Negative,,,
1409.0,felt with the cost that was paid this is not much upto mark ,Negative,Negative,,,
1409.0,all in all pathetic service  you will literally ask  n  number of times for food which is served on table ,,,,Negative,
1409.0,not a wide range of dishes ,,Negative,,,
1409.0,taste not so great especially with mock tails ,,Negative,,,
1409.0,totally disappointed,,,,,Negative
1410.0,thr place is good and the food was great  however the service was slow ,,Positive,Positive,Negative,
1410.0,in mutton biryani the mutton was half cooked which was a spoiler ,,Negative,,,
1410.0,at last we ordered mutton rogan josh and i took ages to be delivered  finally we had to cancel the order and leave ,,,,Negative,
1411.0,service is very bad they dont now how to treat customer ,,,,Negative,
1411.0,they will not suggest what is the special today ,,,,Negative,
1411.0,taste is good but improve ur service ,,Positive,,,
1411.0,service is very slow i call many times to the service boy but he is not responding proper ,,,,Negative,
1411.0,hotel environment is good and taste is awesome ,,Positive,Positive,,
1411.0,but i will not satisfy the service ,,,,Negative,
1412.0,a decent place for party and a cozy climate too ,,,Positive,,
1412.0,veg manchurian was great and chicken kebabs were fine ,,Positive,,,
1412.0,first thing that disappoints me is there is no drought beer and the most annoying thing was the behaviour of the manager  akthar  ,,Negative,,Negative,
1412.0,there has to be some respect towards the guests and the managers was bossing everyone around ,,,,Negative,
1412.0,i m giving this a two star only coz of him else i would have given a   maybe if i had the drought beers ,,Negative,,Negative,
1413.0,food quality and taste is not good ,,Negative,,,
1413.0,super slow service ,,,,Negative,
1413.0,nice ambience but very poor in customer handling ,,,Positive,Negative,
1413.0,lot of items not available even if in the menu ,,Negative,,,
1414.0,a sheer disappointment on   th may      at the buffet dinner  ,,Negative,,,
1414.0,the food was served cold   the service wasn t up to the mark  ,,Negative,,Negative,
1414.0,the only please take thing was the chef guiding us through the course of the meal  ,,,,Positive,
1414.0,the bill was a hand written one with no copy provided  ,,,,Negative,
1414.0,the balance cash was returned after half an hour  ,,,,Negative,
1414.0,utter useless service and truly disappointed  ,,,,Negative,
1414.0,you surely lost a loyal customer  ,,,,,Negative
1415.0,but the bun is so hard that it spoiled the taste ,,Negative,,,
1416.0,first i will talk about the quantity it was upto thw mark as per the price of the food abd now coming to the taste  ,Negative,Negative,,,
1416.0,fried rice was disgusting because it was like made from rice of last night and it was not good to eat ,,Negative,,,
1416.0,coming to manchurian i will say it was a average manchurian and not that good ,,Negative,,,
1417.0,the ambiance is pretty ambivalent with that of a buffet restaurant and casual dining space ,,,Positive,,
1417.0,it was well lit but could really deck up a few notches ,,,Positive,,
1417.0,it was more like a corporate dining room rather than a restaurant ,,,Negative,,
1417.0,upon arrival  were served welcome drink which was good but not living up to the expectation ,,Positive,,Positive,
1417.0,the manager at this place was a nice fellow ,,,,Positive,
1417.0,who carefully took our order of dragon chicken  punjabi chicken curry  and garlic naan ,,,,Positive,
1417.0,i would have like the dish to be more crispy and dry  so that the flavours stick to the chicken ,,Negative,,,
1417.0,it was a hurried preparation of a dish with no amount of time spared for presentation ,,,,Negative,
1417.0,the servers need to be taught a little bit about serving ,,,,Negative,
1417.0,they were fumbling and also were handling hot utensils without using tissue papers ,,,,Negative,
1417.0,simply put  it was a disaster ,,Negative,,,
1417.0,the curry was as bland as it could be ,,Negative,,,
1417.0,most restaurants in this part of india assume that all dishes of punjab are made with tandoori chicken and they seriously need to get out of this blind belief ,,Negative,,,
1417.0,we could only experience the tandoori chicken as the curry had no taste of its own ,,Negative,,,
1417.0,it was just sitting there doing nothing ,,Negative,,,
1417.0,neither it was spicy  not it was tangy ,,Negative,,,
1417.0,it was going nowhere ,,Negative,,,
1417.0,they say they are multi cuisine  but multi cuisine doesn t mean  you can make disaster dishes and pass them off ,,,,,Negative
1417.0,the restaurant is confused whether it should cater to immigrant north indian population or the traditional south indian population ,,,,,Negative
1417.0,one thing that screams out their confusion about the above is their buffet menu ,,,,,Negative
1417.0,they tried to make it a fusion and have ended it making a confusion ,,,,,Negative
1417.0,had the restaurant  been a traditional southern one  i would have been pleased to order a plate of traditional andhra chicken on a banana leaf and would have eaten to my hearts content ,,,,,Negative
1417.0,the restaurant needs to find its footing ,,,,,Negative
1417.0,the owners need to decide which way they want to go ,,,,,Negative
1418.0,very spicy shawarma  not for people like who don t eat spicy ,,Neutral,,,
1418.0,based on rating went to try but it was very spicy couldn t finish it and ended up having upset stomach ,,Negative,,,
1419.0,this place has decent breakfast options but the omlettes are just ordinary with not much u can praise about and yeah it comes with one bread piece ,,Neutral,,,
1419.0,filter coffee was decent though bitter ,,Neutral,,,
1419.0,you will get better omlettes anywhere else  this is hyped ,,Negative,,,
1420.0,gongura biryani was nice but quantity for two people is too much and apollo fish was not tasty,,Negative,,,
1421.0,food is cold   n not even tasty,,Negative,,,
1422.0,very less quantity ,,Negative,,,
1423.0,i had gone for lunch a few days back and no doubt the place and food is amazing but i was not given the dessert which was included in the platter and the staff is always looking at you while you re eating  until you finish ,,Positive,Positive,Negative,
1423.0,  stars for food and ambience respectively but for the service they provide  i m not at all happy with the place ,,Positive,Positive,Negative,
1424.0,the ambience is good ,,,Positive,,
1424.0,but the food wasn t upto the mark ,,Negative,,,
1424.0,the non veg starters were horrible ,,Negative,,,
1424.0,full of bones ,,Negative,,,
1424.0,the veg starters were okayish ,,Neutral,,,
1424.0,the variety was less ,,Negative,,,
1424.0,the main course was okay ,,Neutral,,,
1424.0,there was variety but no taste ,,Neutral,,,
1424.0,there were hardly any desserts ,,Negative,,,
1424.0,disappointed ,,,,,Negative
1425.0,the rating is such because of the name we had thought it was like an american grill restaurant shocked by the indian spread  food was ordinary  no choice in red meats and no grill pls change the name  gives out the wrong idea,,Negative,,,
1426.0,the noodles were so fat and without any taste ,,Negative,,,
1426.0,the sauces or the fry that noodles went through  there was no taste at all in it ,,Negative,,,
1426.0,it was not even having the basic salt ,,Negative,,,
1426.0,thus  i could not even complete the noodles ,,Negative,,,
1426.0,was not at all satisfied with the noodles combo box ,,Negative,,,
1427.0,unhappy ,,,,,Negative
1427.0,mezze platter had no taste and they took over    mins to prepare the food in spite of showing an expected delivery time of    mins ,,,,Negative,
1427.0,not satisfied with service or taste ,,Negative,,Negative,
1427.0,thumbs down for me ,,,,,Negative
1428.0,given that the ambiance and maintenance is pathetic ,,,Negative,,
1428.0,it looks and feel extremely unhygienic to the point that we had second thoughts eating there ,,,Negative,,
1428.0,staff was extremely disorganized and there were many customers seen complaining ,,,,Negative,
1428.0,so for ambiance and hygiene it s a complete no    food was okay we ordered apollo fish starter which was very hard ,,Negative,Negative,,
1428.0,and spcl mutton biryani which was good but nothing exceptional and paradise or pista house has better taste than it ,,Neutral,,,
1428.0,quantity wise it was sufficient for both of us ,,Positive,,,
1428.0,and it was pocket friendly hence   ratings ,Positive,,,,
1428.0,i would not be visiting or suggesting this place to anyone ,,,,,Negative
1429.0,this restaurant provides good food only but i was not happy about that i had asked for double masala but they didn t gave me that food so was upset at that time,,,,Negative,
1430.0,chocolate quality is very bad considering the high price ,,Negative,,,
1430.0,it tastes similar to an equivalent    rupees milkshake you get in cartons ,,Negative,,,
1430.0,i so lodge recommend this to anyone ,,,,,Negative
1431.0,not a place i would visit again ,,,,,Negative
1431.0,menu is very limited and cocktails got no alcohol at all ,,Negative,,,
1431.0,visited on a friday night and totally disappointed ,,,,,Negative
1431.0,crowd also not good  ,,,Positive,,
1431.0,never visit would be my advice    hyderabad got tons of better options ,,,,,Negative
1432.0,food is cool,,Negative,,,
1433.0,we have ordered paneer manchurian but all pieces of paneer are very hard to bite struggled alot  got irritated that s why we won t prefer this to anyone,,Negative,,,
1434.0,i ordered mexican corn and punjabi aloo paratha  quality        i didnt like it at all   parathas were very thick and hard plus burnt   chutney was so tasteless that i felt i am eating grass and salt  quantity        parathas with chutney   curd and butter  value for money      packaging     ,Positive,Negative,,Positive,
1435.0,visited this place for the good experience we hd earlier at their jubilee hills outlet but at yachi bolu it was a disappointing experience purina chutney was sour   methi chicken was bitter ,,Negative,,,Negative
1435.0,don t think will visit again ,,,,,Negative
1435.0,attitude of service staff was ok ,,,,Neutral,
1436.0,chokha was worse or stale ,,Negative,,,
1436.0,paneer tikka was painted in orange color ,,Negative,,,
1436.0,very inexperienced way of delivering ,,,,Negative,
1436.0,overall not recomend ,,,,,Negative
1437.0,never try ulvacharu biryani here  the worst i ever had dont at all try any biryanis  and the butter chicken was too sweet and the butter naan wer too hard,,Negative,,,
1438.0,i love karachi for its taste ,,Positive,,,
1438.0,no issues with the food ,,Neutral,,,
1438.0,they just threw the pastry in the box and no spoon was given ,,,,Negative,
1438.0,however the pastry was awesome ,,Positive,,,
1439.0,restaurant with lot of open place and average food ,,Neutral,Positive,,
1439.0,went with friends for lunch  what ever we ordered veg or non veg  started   main course all are not upto mark ,,Negative,,,
1439.0,no one of us r happy with food served ,,Negative,,,
1439.0,serving is fast  ambience is ok ,,,Neutral,Positive,
1440.0,no napkins provided n all the sauce was coming out already   ,,,,Negative,
1440.0,packing was poor n cheap    not so satisfied even with the taste,,Negative,,Negative,
1441.0,thrice i visited this place thinking it might change my opinion but as always it was a disappointment ,,,,,Negative
1441.0,the staff and the manager extremely rude the service really bad ,,,,Negative,
1441.0,looks like the place does not need customers at all coz i haven t come across any waiter who would refuse to serve ,,,,Negative,
1441.0,complained to the manger who was equally rude  ,,,,Negative,
1441.0,food and drinks are alright but i got wine served in a plastic foggy glass   i go out for the experience when i spend money   ,,Neutral,,Negative,
1441.0,i m not sure about the others but i had a horrible experience ,,,,,Negative
1442.0,we went to urban asia for lunch around      on a sunday for ala carte and i certainly would not recommend it for anyone ,,,,,Negative
1442.0,though the food was good  the service was pathetic ,,Positive,,Negative,
1442.0,we were ignored for more than half an hour despite calling for the waiters multiple times ,,,,Negative,
1442.0,we were not even given the speciality menus despite specifically asking for it ,,,,Negative,
1443.0,i personally liked the bagel with cheese and capuccino ,,Positive,,,
1443.0,we were disturbed by the noise and hence couldn t stay longer ,,,Negative,,
1443.0,good for groups ,,,,,Positive
1444.0,good place to go around ambience is good and crowd is good over weekends food was not that good which i thought of must try jalepeno cheese poppers ambience     food     seevice       ,,Neutral,Positive,,
1445.0,the place has good service too  the servers are helpful ,,,,Positive,
1446.0,price is nice but quantity of curry not good ,Positive,Negative,,,
1.0,i ordered egg soft noodles from here  they didn t even included spoon or spork for the item    how i have to eat noodles and also full of oily,,Negative,,Negative,
2.0,ice cream was good   but it s totally got melt as delivery boy took a lot of time to reach ,,Positive,,Negative,
2.0,he mentioned it as delivered as soon as he picked order ,,,,Negative,
2.0,he took nearly    minutes to come ,,,,Negative,
3.0,food was not good its from yesterday s food with less quanity i asked to customer care some one told they will refund and after    mins some one told not possible without giving proper food you people are charging and telling we are sorry if you will go for old chat also same issue i am facing maximum times this service is very bad services provding zomato i will put a complain to food inspection team they will definitly take a action zomato is full of fraud service it shuold stop some times delivery guys are eating customers food  sometimes providing   days back food to customers ,,Negative,,Negative,
4.0,food feels like the afternoon prepared and sent on dinner ,,Negative,,,
5.0,bad reception and unprofessional staff do not visit this place they are unfriendly they just loot your money and the prices are also very high,Negative,,,Negative,
6.0,really very disappointed with quantity of chicken in the biryani,,Negative,,,
7.0,we ordered egg biryani and we were delivered chicken biryani with chicken replaced with eggs ,,,,Negative,
7.0,he tried his best to pose it as egg and biryani but he forgot to remove bones from the biryani ,,,,Negative,
7.0,wouldn t order egg biryani from here again ,,,,Negative,
8.0,i don t know why they are so obsessed with oil ,,Negative,,,
8.0,i found half of the container comes filled with oil only ,,Negative,,,
8.0,i bet you can t chew their chapatis if you have teeth strong enough to break stones ,,Negative,,,
8.0,really bad quality food for health   ,,Negative,,,
8.0,they will surve just oil   this oil i have removed from dal   more than that came in paneer as well which i have ordered earlier few months back ,,Negative,,,
9.0,very late delivery,,,,Negative,
10.0,worst taste   buffet is not at all good   service is too bad  price is not worth with the food   please don t choice this restaurant     rating is too much for it  ,Negative,Negative,,Negative,
11.0,i will be brutality true  ,,,,,Negative
11.0,there s a reason why they are giving huge discounts via different booking table reservation platforms ,,,,Negative,
11.0,service   very very slow even on a weekday ,,,,Negative,
11.0,seems kitchen is highly understaffed ,,,,Negative,
11.0,food  pathetic ,,Negative,,,
11.0,i haven t had so pathetic kababs here in hyderabad  like what i got at arena eleven ,,Negative,,,
11.0,overall a big no ,,,,,Negative
11.0,please don t waste your money here ,,,,,Negative
11.0,it was too salty ,,Negative,,,
11.0,you can t even chew the chickn pieces  it was so hard   tasteless ,,Negative,,,
11.0,ordered a mocktail for my wife  it was full of water instead ,,Negative,,,
12.0,the worst experience ever ,,,,,Negative
12.0,ordered achari ghoshti it came with more salt later asked him he repaired the remaining curry after half an hour ,,Negative,,Negative,
12.0,also the service was too slow and pathetic ,,,,Negative,
13.0,very bad place to hang on  the staff is very arrogant and short tempered ,,,,Negative,
13.0,they don t allow entry to stags on the dance floor also and despite of so high prices haven t given any discount even not corporate discount too ,Negative,,,Negative,
15.0,food was terrible,,Negative,,,
16.0,i ordered   donuts online and all of them were hard and not fresh ,,Negative,,,
16.0,and not edible to eat at all ,,Negative,,,
16.0,i have no option but to throw them in the dust bin ,,Negative,,,
16.0,very very disappointed ,,,,,Negative
17.0,went here for a team lunch party a while back and i swear to god the food was pathetic ,,Negative,,,
17.0,the starters they server were cold and even after calling out the waiter multiple times there wasn t a positive response ,,Negative,,Negative,
17.0,when we called the manager  there was a redo of the starter which was hot now but not tasty ,,Negative,,,
17.0,the ambience is good though ,,,Positive,,
17.0,if only the food and service were upped then the place could deserve better rating ,,Negative,,Negative,
18.0,i ordered chicken pot rice  pot rice is usually wet n not dry  this one was actually dry and it wasn t made with the wet gravy how pot rice is actually made  and they made chinesee like biryani  seriously ,,Negative,,,
18.0,it was actually hydrabadi pot rice lol ,,,,Negative,
19.0,today i was disappointed with their service and how they ve handled an issue  reg soup  reported ,,,,Negative,
19.0,even the manager at gachibowli proved useless   i never thought i will write such a review for khan saab ,,,,Negative,
20.0,pathetic and rude staff ,,,,Negative,
20.0,slowest service ,,,,Negative,
20.0,they had tables free at terrace and at lower floor but still they say that its full ,,,,Negative,
20.0,so that there upper floor gets full first which is not good ,,,,Negative,
20.0,will never visit again ,,,,,Negative
21.0,worst service ,,,,Negative,
21.0,strictly nor recommended for family and decent people ,,,,,Negative
21.0,taste is below average ,,Negative,,,
21.0,big no for this place   stay away ,,,,,Negative
21.0,worst service ever,,,,Negative,
22.0,what a hopeless restaurant ,,,,,Negative
22.0,never experienced such horrific and unprofessional restaurant ,,,,Negative,
22.0,if you order a dish  be assured you will get cheaper   stale and some other item ,,,,Negative,
22.0,i have ordered chicken manchurian and egg noodle box  i received old stake gobi munchurian with just minimum two three spoon of pathetic noodle ,,Negative,,Negative,
22.0,please dont dare do visit there,,,,,Negative
23.0,very spicy food ,,Neutral,,,
23.0,even the soup was ultra spicy ,,Neutral,,,
23.0,starters were average ,,Neutral,,,
23.0,main course could have more variety and some taste ,,Negative,,,
23.0,even the desserts were not good ,,Negative,,,
24.0,worst food ever     ,,Negative,,,
24.0,very bad taste  i will give negative rating   no dishes were properly made very bad experience ,,Negative,,,
24.0,just name is big but no quality and taste maintained,,Negative,,,
25.0,very very bad sooo waste taste less dont take order online very very bad sooo waste taste less dont take order online ,,Negative,,,
25.0,very very bad sooo waste taste less dont take order online,,Negative,,,
26.0,horrible place nothing for vegetarians service is awful paneer was not properly cooked corn cubes were hopeless we had to wait for an hour to get vegetarian starters the main course for vegetarian dishes was empty,,Negative,,Negative,
27.0,if you are looking for north indian food in hyderabad then do not visit this place ,,,,,Negative
27.0,the waiters will not listen if food is late  manager is totally uncivilized  tries to peek into customers wallet and also talks rudely  ,,,,Negative,
27.0,we ordered       daal makhani  not even average      paneer  serverd with hair in it      biriyani  below average      tandoori roti     sweet lassi  after finishing the food  they will serve you finger bowl with food particles already present in it    ,,Negative,,,
27.0,food        staff        ambience        hygiene        i will never recommend this place to anyone ,,Negative,Negative,Negative,
28.0,today i have ordered cashew polau from zomato  i have received the parcel box unpacked and seems some part of food item from one side has taken out of box ,,,,Negative,
28.0,i have reported to zomato as well  but from next time onwards i will make sure not to order from this restaurent ,,,,,Negative
29.0,we ordered food for home delivery with one line instruction   garlic bread to be prepared without spices  which was not fulfilled ,,,,Negative,
29.0,this was ok  what wasn t was delivery of chicken ,,,,Negative,
29.0,we ordered vegetarian cheese balls and we received chicken ,,,,Negative,
30.0,i ve ordered their keema pav on swiggy and i was very dissatisfied with it ,,Negative,,,
30.0,the keema was stale and blubbery ,,Negative,,,
30.0,their is lot of fat and meat was very minimal ,,Negative,,,
30.0,i couldn t finish even half of the portion served ,,Negative,,,
30.0,and it was very clear that the dish mutton is not fresh ,,Negative,,,
30.0,ps  it had a bad effect on my tummy as well ,,Negative,,,
31.0,too bad but tasty,,Positive,,,Negative
32.0,it was extremely bad ,,Negative,,,
32.0,the rice seemed to be cooked with a lot of baking soda ,,Negative,,,
32.0,kadhi was awful to taste ,,Negative,,,
32.0,avoid this dish ,,Negative,,,
33.0,pathetic ,,,,,Negative
33.0,don t order through them ,,,,,Negative
33.0,neither do they have the decency of answering calls and informing nor do they have people to deliver ,,,,Negative,
33.0,disappointing ,,,,,Negative
34.0,worst experience in parcel of zaffron motton regular biryani no mutton piecec found i  biryani bill is       with gst    ,Negative,Negative,,,
34.0,fooling public in parcel   dont take pacel frm pista house    ,,Negative,,,
34.0,very bad experience simply looting public money on parcels of biryani      ,,Negative,,,
35.0,having heard a lot about this place  specially their triveni biryani  i came here once and ordered food     times   the last time i purchased food here would actually be the last time i would eat from here ,,,,,Negative
35.0,this restaurant is a classic example of how it started on a grand note and ended up being just another restaurant with hygiene issues ,,,,,Negative
35.0,  paneer tikka biryani and bhimwaram pulav  take aways   in spite of telling them  both items were very spicy ,,Neutral,,Negative,
35.0,my wife and i were struggling with the food ,,Negative,,,
35.0,now to top it  i found a flying insect  not a cockroach but something else with wings  that got cooked with the paneer tikka biryani ,,Negative,,,
35.0,alas  that was so repulsive that i left the food mid way and satiated my hunger with curd rice  i m never going back to them,,Negative,,,
36.0,didn t find any taste in chicken momos  the veg momos were horrible   stuff inside the momos were not boiled properly   will never order from them again,,Negative,,,
37.0,one of the best worst place   biryani is too worst   but their strtegy is too good   they dont have ac but if we sit and eat the price is double  irresponsible serice   better to go to almas r biryanis   good bye  will never visit again,Negative,,Negative,,
38.0,i got very sick after having this food,,Negative,,,
39.0,i am very very biryani lover and i tried the behrouz biryani and it was worst ,,Negative,,,
39.0,taste is too bad   ,,Negative,,,
39.0,packing is too good but taste is too bad,,Negative,,Positive,
40.0,no taste in food  starters were served cold  probably it was already cooked so waiter suggested us that dish ,,Negative,,,
40.0,it is expensive and not worth at all ,Negative,,,,
