id,sentence,price,quality,environment,service,other
2329.0,fruit poison had exotic fruits like kiwi and strawberry and tasted really well ,,Positive,,,
2329.0,they know their stuff well and i will prefer their items over cream stone for sure ,,Positive,,,
2330.0,very nice ambience with a courteous staff  i particularly liked the hospitality of a service boy named ashok   he recommended the best food and provided an excellent service ,,,Positive,Positive,
2330.0,the food was nice ,,Positive,,,
2331.0,food is delicious ,,Positive,,,
2331.0,chicken bbq mandi  mutton fry mandi and chicken burger are awesome    good ambiance and service   ,,Positive,Positive,Positive,
2331.0,owner and staff are courteous,,,,Positive,
2332.0,thank you so much for the excellent food it tasted great ,,Positive,,,
2332.0,price quality everything good ,Positive,Positive,,,
2332.0,delivery package was also great if there was a way if packaging more environment friendly that would be great,,,,Positive,
2333.0,low crowd made us feel even more comfortable ,,,Positive,,
2333.0,attractive and romantic ambience   tasty food and very much reasonable    good service  ,,Positive,Positive,Positive,
2333.0,i had chicken breast steaks with mashed potatoes and salad   unexpectedly so good taste ,,Positive,,,
2333.0,it tasted incredibly hot and yummy ,,Positive,,,
2333.0,in recent times i ve never been to such a good place with decent crowd and tastyyyy food ,,Positive,Positive,,
2333.0,i agree that prices are high but i forgot about the price when i had one spoon of food ,Negative,Positive,,,
2333.0,do visit this place with your loved ones i bet you will have a perfect date ,,,,,Positive
2334.0,the food was great and value for money ,Positive,Positive,,,
2334.0,quantity is less ,,Negative,,,
2334.0,good ambience ,,,Positive,,
2334.0,quantity     taste       ambience      ,,Neutral,Neutral,,Neutral
2335.0,frankly speaking  i wasn t expecting such good food ,,Positive,,,
2335.0,i felt there could have been a better variety of chutneys  like tamarind or ginger  apart from the regular coconut one ,,Negative,,,
2335.0,not only did the food make us feel satiated  but also satisfied ,,Positive,,,
2336.0,good one ,,,,,Positive
2336.0,the servicing here is very slow ,,,,Negative,
2336.0,i have been here twice and it took more than half an hour to get the starters ,,,,Negative,
2336.0,staff are polite and friendly ,,,,Positive,
2337.0,triveni biryani was awesome    ,,Positive,,,
2338.0,we ordered aloo jeera and some of the pieces tasted stale ,,Negative,,,
2338.0,it was like the old and new dishes were mixed  ,,Negative,,,
2339.0,i have tasted both   muttonbiryani      chickenfrybiryani  mutton biryani was tasty  but  chicken fry biryani was just decent biryani the fried chicken peices were as similar to  chicken      scoreboard   taste   muttonbiryani           chickenfrybiryani         valueformoney   muttonbiryani         chickenfrybiryani      ,Positive,"{""choices"":[""Positive"",""Neutral""]}",,,
2340.0,need more quantity  because we paid toomuch for a single biriyani   ,Negative,Negative,,,
2341.0,went today on a relaxed late lunch ,,,,,Positive
2341.0,decided to go to the nearest place for food ,,,Positive,,
2341.0,easily locatable  decent place ,,,Neutral,,
2341.0,liked the food  simple and good in taste ,,Positive,,,
2341.0,for the first time  loved the rotis here ,,Positive,,,
2341.0,fulka rotis tasted yummy with hot dal makhani ,,Positive,,,
2341.0,had a full fledged lunch paying reasonable prices  ,Positive,Positive,,,
2342.0,the wait time was almost    mins  so better call them up beforehand if you are a corporate team ,,,,Negative,
2342.0,coming to price and taste  it is worth the money with quantity and taste both satisfying the money ,Positive,Positive,,,
2343.0,good out door sitting restaurant to spend some pleasent evening time ,,,Positive,,
2343.0,it s a quite and less crowded to have andhra style spicy food ,,Positive,Positive,,
2343.0,food was bit spicy but manageable and good ,,Positive,,,
2343.0,chicken was well cooked and tasty ,,Positive,,,
2343.0,quantity was bit less when compared to it s price range and it s compititers ,Negative,Negative,,,
2343.0,but still it can be miantained well  quality      quantity     price range            means it s costly  service     taste     ambiance      for outdoor sitting ,Negative,Neutral,"{""choices"":[""Negative"",""Neutral""]}",Neutral,
2344.0,very less priced restaurant located in sln terminus ,Positive,,,,
2344.0,tangdi kebab dint meet the expectations  ,,Negative,,,
2344.0,bit oily and taste was ok but the mint chutney served with it was delicious  ,,"{""choices"":[""Positive"",""Negative"",""Neutral""]}",,,
2344.0,chicken tikka biriyani was good  ,,Positive,,,
2344.0,chicken was tender soft and biriyani flavour was good  ,,Positive,,,
2344.0,zomato gold is applicable here so it costed only     bucks for two  ,Positive,,,,
2344.0,quite impressed with it  ,,,,,Positive
2344.0,   service was quick  ,,,,Positive,
2345.0,this place is good for any food though the main highlight is the special biryani ,,Positive,,,
2345.0,biryani lovers will happily go home tummy full ,,Positive,,,
2345.0,also the chicken fried rice is a must try here ,,Positive,,,
2346.0,the taste of the irani chai and mawa cake can be improved by at least      levels ,,Negative,,,
2347.0,this place wasn t crowded at all ,,,Neutral,,
2347.0,the staff was very friendly ,,,,Positive,
2347.0,i thoroughly enjoyed the cream of mushroom soup ,,Positive,,,
2347.0,we also ordered a pizza which was huge and more than filling ,,Positive,,,
2347.0,well  pretty much sums up to be a pretty and decent place where i wouldn t mind dining again   ,,,,,Positive
2348.0,when you love food and especially north indian food you crave for the perfect butter chicken that you would probably get up north ,,Positive,,,
2348.0,i guess i finally seemed to have found it in hyderabad ,,,,,Positive
2348.0,having been to the best indian food joints like grand trunk  norfest i guess the butter chicken here ranks at the top    each one of them are good in their own regard though  ,,Positive,,,
2348.0,i landed up at this place basis my online food orders not through zomato but through swiggy   somehow that s an irony given that both deliver the same distance zomato doesn t deliver from here to my place   so probably i will not comment on ambience and service   will update that later once i visit the place but food is something that s outstanding  in the last    days i would have ordered     times that s a lot for me given that i don t get fixated to a place as i m more of a food explorer   ,,Positive,,,Positive
2348.0,the food has not disappointed me so far ,,Positive,,,
2348.0,items tried so far punjabi butter chicken   must recommend   the best you will find in town veg angara   good bhatti kamurg   must try tandoori momo   can be avoided dahi ke kebab   brilliant for vegetarians murg malai kebab   good murg tikka masala   must recommend  the best part is that both the gravy s   of this and butter chicken  are completely different which is hard to find ,,Positive,,,
2348.0,a person who loves chicken will understand my sentiments dal makhani   must try tandoori murgh   must try  so that pretty much sums up my journey with the restaurant for the past   weeks   it s awesome do try if they deliver to ur place ,,Positive,,,
2348.0,overall   ambience na service na food   value for money  ,Positive,Positive,Positive,Positive,
2349.0,the chocolate brownie and waffles will take you by an awwww ,,Positive,,,
2349.0,for someone who craves for chocolate  it s a perfect place ,,Positive,,,
2349.0,the ambience is just decent ,,,Neutral,,
2350.0,have been a huge fan of this chain since      ,,Positive,,,
2350.0,this gachibowli bbq nation has some items missing from its live counter  but have curd rice which wasn t available in any other location i have been to ,,Neutral,,,
2350.0,the staff is extremely courteous ,,,,Positive,
2350.0,we were served by rajib  who was really warm  quick in his service ,,,,Positive,
2350.0,the overall quality of the food was satisfying  just like most of the other outlets i ve been to ,,Positive,,,
2351.0,when it comes to experience  this is one of the places i ll remember for long   went on a saturday night and was welcomed with sweet latin music with people dancing in some latin form    could be salsa or any other form considering they have so many   definitely they were not the guests  looking at their proficiency   ,,,Positive,,
2351.0,very good food    not so great beer from their in house brews    you will be shocked to see some healthy variants    worthy try though   ,Neutral,"{""choices"":[""Positive"",""Negative""]}",,,
2351.0,overall a must go place for the experience ,,,,,Positive
2352.0,the lovely place is properly situated at the prominent cross roads of biodiversity  gachibowli  right opposite to nissan showroom ,,,,,Positive
2352.0,the place and its ambiance is quite cozy as the lighting is subtle and ambient which blends in pretty well with the interiors of the restaurant ,,,Positive,,
2352.0,the staff is exceptionally attentive and a special shout out to mr  sudhir for completely taking care us and treating us with an excellent dinner ,,,,Positive,
2352.0,as soon as we sat down  we were greeted enthusiastically with mocktails ,,,,Positive,
2352.0,out of all the mocktails  masala cola and mango lassi stood out and were the best ,,Positive,,,
2352.0,the other mocktails were equally good and refreshing ,,Positive,,,
2352.0,delicious appetizers   crispy veg  a variety of vegetables deep fried and garnished with aromatic flavors was something that wasn t new that we didn t have  but it tasted excellent ,,"{""choices"":[""Positive"",""Neutral""]}",,,
2352.0,corn     it tasted absolutely delicious ,,Positive,,,
2352.0,thoroughly recommended ,,,,,Positive
2352.0,bangla kodi  which was a signature dish of the restaurant  but for us it was a dish that also stood apart ,,Positive,,,
2352.0,chilli prawns  spicy  stirred fried  it tasted awesome ,,Positive,,,
2352.0,tender chicken  the star of the appetizers ,,Positive,,,
2352.0,highly recommended  please don t miss out on this dish ,,Positive,,,
2352.0,apart from that about the taste was okays ish ,,Neutral,,,
2352.0,main course   chettinad chicken  very spicy and it went absolutely well with the butter naan ,,Positive,,,
2352.0,kolhapuri chicken  mild flavours  the taste was good ,,Positive,,,
2352.0,uluvacharu chicken biryani  this was the highlight of the dinner  unique taste and flavors  the restaurant lived up to the name of biryani  highly recommended ,,Positive,,,
2352.0,avakai chicken biryani  a novel kind of taste for me and i really liked it ,,Positive,,,
2352.0,afghani chicken biryani  mild flavor biryani topped with egg omelet  it tasted really good ,,Positive,,,
2352.0,desserts   qubani ka meetha  junnu and gulab jamun were served to us and we were extremely dissatisfied with the desserts ,,Negative,,,
2352.0,i earnestly request the effective management to please look into the dessert part ,,Negative,,,
2352.0,everything else made it a great evening to hang out with family and friends for good indian biryani flavours ,,Positive,,,
2353.0,on the   th floor  the view from the outdoor seating is beautiful  the indoor is nice and lavishly yet elegantly decorated  though i personally like outdoors ,,,Positive,,
2353.0,the dance floor is a little small but hey the dj has to be good right  ,,,Negative,,
2353.0,with their whole ranged of brewed beers     different samples to try out and one can order a sample of all to taste and decide ,,Positive,,Positive,
2353.0,i like ale above all ,,Positive,,,
2353.0,honey chilli patao has great spicy and sweet balance but a bit of onion to the fry would have made it a best dish ,,Positive,,,
2353.0,dahi ke kabas were good to taste with the green chutney ,,Positive,,,
2353.0,lasagne is good and pasta is so so and i didn t like it that much ,,"{""choices"":[""Positive"",""Negative""]}",,,
2353.0,food is average here but a glass of beer and one won t mind ,,"{""choices"":[""Positive"",""Neutral""]}",,,
2353.0,wines are not that great too so go for beer    the staff is good and friendly ,,Negative,,Positive,
2353.0,the price is a bit on expensive side i would say ,Negative,,,,
2353.0,there are minimal cover charges for the pub ,Positive,,,,
2353.0,the embience is feel good and enjoy the night away kinda so it s fun ,,,Positive,,
2353.0,the dj is amazing and i always had great time shaking my leg on the floor ,,,Positive,,
2353.0,so it s a must go if u still haven t been here ,,,,,Positive
2354.0,great ambience ,,,Positive,,
2354.0,the food tasted good as well ,,Positive,,,
2354.0,removing one star because of lack of vegetarian options  if they add more options before my next visit  i ll gladly revisit my rating ,,Negative,,,
2355.0,decent food with good quality ,,Positive,,,
2355.0,dal makhani  aaloo gobhi are good ,,Positive,,,
2355.0,amongst the bread  stuffed kulcha and lachcha paratha are nice ,,Positive,,,
2355.0,it s a pocket friendly place and the quantity served is good enough ,Positive,Positive,,,
2356.0,had hot chocolate was not worth trying and camomile tea which was good enough ,,"{""choices"":[""Positive"",""Negative""]}",,,
2356.0,loved the ambiance ,,,Positive,,
2356.0,hospitality is something which i loved the most ,,,,Positive,
2357.0,nice ambience to enjoy the night food is not that great but their alcohol section is decent service is fantastic and the waiters and staff are really kind,,Negative,Positive,Positive,
2358.0,ordered all vegetarian dishes and everything was good to taste but almost everything was a bit too oily ,,"{""choices"":[""Positive"",""Negative""]}",,,
2358.0,staff is well behaved and professional ,,,,Positive,
2359.0,definitely worth a try if you re looking for some lip smacking north indian food ,,Positive,,,
2359.0,must try  kadai paneer  garlic naan  shikari murgh  dum ke aloo  and chicken nachos ,,Positive,,,
2359.0,patiala lassi is a must try as well but i wasn t too happy about it cause it didn t have much authenticity to it ,,Negative,,,
2360.0,location  prominently located just opposite to south india shopping mall  ambience  simple yet funky designer interiors ,,,Positive,,
2360.0,small yet comfortable sitting area   good place for grab a coffee  food  ordered there spcl thin crust pizza which was really awesome  ,,Positive,Positive,,
2360.0,death by chocolate  its an awesome combination of choclate n cream which blow u away   overall a good place to hang out,,Positive,,,Positive
2361.0, one of the best brunches   people with a sweet tooth   you should go     food       ambiance       service        feast is one of the biggest spreads i saw in a buffet  ,,Positive,Positive,Positive,
2361.0,it has continental  chinese and indian cuisine and chats with a huge variety  ,,Positive,,,
2361.0,the ambiance is decent  ,,,Neutral,,
2361.0,the very sight can be deadly to a diabetic patient  ,,Positive,,,
2361.0,perfect place for ppl with a sweet tooth   a big selection of pastries  cheese cakes along with many indian specialties  ,,Positive,,,
2361.0,i couldn t see prawns   chicken popcorn was so crispy on the outside and the chicken soft in the inside  ,Positive,,,,
2361.0,the best starter of all  ,,,,,Positive
2361.0,the other starters are okeyish  ,,Neutral,,,
2361.0,in the main course  chciekn biryani and lal maas were the best  ,,Positive,,,
2361.0,overall a very good experience      the on  table service was slow  ,,Positive,,Negative,
2362.0,shawarma here is the best ,,Positive,,,
2362.0,the way the chicken taste is just amazing ,,Positive,,,
2362.0,don t know about biryani  but if you are looking for an amazing shawarma experience  you must try this ,,Positive,,,
2363.0,an wxtra star for dance floor ,,,,Positive,
2363.0,waahaaaa whatta a night it was ,,,,,Positive
2363.0,a great dance floor and friendly dj ,,,Positive,,
2363.0,it was a night i can t forget food yum manchurian  noodles  pasta  pizza were great ,,Positive,,,
2363.0,would nt mind going again ,,,,,Positive
2364.0,it s always good to see restaurants which focus on hyderabadi cuisine since it s so diverse and encompasses a lot of different varieties within it ,,Positive,,,
2364.0,hyderabadi daawat does justice to it s name but treating us to good hyderabadi food ,,Positive,,,
2364.0,the restaurant is located on the gachibowli   kondapur mainroad with convenient parking ,,,Positive,,
2364.0,the interiors are classy and comfortable ,,,Positive,,
2364.0,the dish that started off the daawat was the yakhni shorbha which was meticulously done   spicy  meaty and the meat was literally falling apart from the bone ,,Positive,,,
2364.0,achari paneer   seasoned with pickle masalas and was just cooked to perfection ,,Positive,,,
2364.0,sabz ki shami   the textures felt a little strange to me ,,Neutral,,,
2364.0,tandoori aaloo  soft and fluffy stuffed potatos with crispy grilled skins on the exterior murgh kalmi kebab   marinated chicken in mild spices grilled to perfection in a tandoor ,,Positive,,,
2364.0,gosht seekh kebab  it is extremely easy to dry out a seekh kebab but they nail it here ,,Positive,,,
2364.0,patrani fish and tandoori jhinga needed a improvement as they lacked depth of flavour and taste ,,Negative,,,
2364.0,their main course comprised of murgh mussalam  nargisi kofta  achari murgh  shahi paneer  dal akbari  gosht masala ,,Neutral,,,
2364.0,their sikandari raan and murgh mussalam deserve a special mention ,,Positive,,,
2364.0,a variety of mocktails are available out of which my personal favourites happen to be the lemon mint cooler  cinderella   slightly on the sweeter side  and coco baliney ,,Positive,,,
2364.0,their service was exceptional where the minutest details were taken care of ,,,,Positive,
2365.0,ambiance  good staffs  they dont have a lot of staffs to buzz around you but whoever is there they are very courteous ,,,Positive,Positive,
2365.0,price  price is good must have  paneer lababdar and fish tikka food  food was good quantity is also good as per price good place for casual dinner,Positive,Positive,,,
2366.0,a nice noisy eventful saturday night happens here ,,,Positive,,
2366.0,well typically if you are stags very difficult to get entry on saturdays and by luck you are in you have to dance outside of the dance floor ,,,,Negative,
2366.0,food was above average ,,Neutral,,,
2367.0,the pasta alone is too good to fetch the high rating ,,Positive,,,
2367.0,the service is another reason for it ,,,,Neutral,
2368.0,this has been a good find ,,,,,Positive
2368.0,almond and au chocolate croissants were buttery light and delicious ,,Positive,,,
2368.0,mushroom quiche though small  was filled with umami  served with caramelised onion ,,Negative,,,
2368.0,their sandwiches use their own artisanal bread which gives great taste and texture ,,Positive,,,
2368.0,i love that their bread  pasta  pizza base  etc is all made in house with quality ingredients and no preservatives and artificial flavouring ,,Positive,,,
2368.0,this is rare  and so nice ,,,,,Positive
2368.0,there s also some great looking fresh breads for sale  we picked one up  wrapped in paper ,,Positive,,,
2368.0,there may be room for improvement with the coffee maybe stock some artisanal coffees from brands popping up in the country ,,,Negative,,
2368.0,overall  i d recommend eclat over a lot of the generic so called cafes ,,Positive,,,
2368.0,people complaining about the price are better off visiting a cafe coffee day ,Positive,,,,
2369.0,one of the best restaurant to visit and have freaky chat with friends good ambiance and good place for corporate team lunch very well established place to dine in ,,Positive,Positive,,
2370.0,biryani is good but tandoor was not up to mark   but still for non vegetarian  this place is heaven   ,,"{""choices"":[""Positive"",""Negative""]}",,,
2370.0,plenty of items at reasonable price  ,Positive,,,,
2371.0,i m obsessed with the irani chai at karachi cafe ,,Positive,,,
2371.0,the first time i had irani chai was here and i fell in love with the place ,,Positive,,,
2371.0,my friend and i come here once in a while to catch up and we just love this cafe ,,,,,Positive
2371.0,it s so cute  quiet  and very pretty ,,,Positive,,
2371.0,i love the theme ,,,Positive,,
2371.0,i m not really sure how the food is ,,Neutral,,,
2371.0,we ve had their mawa cake which goes great with the chai and the paneer sub which wasn t that great ,,Neutral,,,
2371.0,but nonetheless  it s one of my favorite places ,,,,,Positive
2372.0,deli  has a lots of good food to offer and that s why i flock the place pretty frequently ,,Positive,,,
2372.0,my favorite here is their pan fried fish steak sizzler  if you are not a fan of sizzlers  request them and they would serve it sans the fanfare  ,,Positive,,,
2372.0,tried their grilled tenderloin steak as well  but it did not live upto the expectations ,,Negative,,,
2372.0,it was dry and chewy sadly ,,Negative,,,
2372.0,their pastas are quite tasty  we tried ours in pink sauce   so are their pizzas  we tried garden veg  ,,Positive,,,
2372.0,if you like fish and chips  try it out here  will not be disappointed ,,Positive,,,
2372.0,their cold coffee isn t that great  bitter and watery  i like the creamy and balanced kind  ,,Negative,,,
2372.0,if you like mocktails  i would suggest that you leave out the ginger lime fizz ,,Negative,,,
2372.0,it s a poor version of our limca ,,Positive,,,
2372.0,the mojitos here are pretty refreshing though ,,Positive,,,
2373.0,nice interior with really good shakes ,,Positive,,,
2373.0,its a good place to hangout with your friends ,,,,,Positive
2373.0,price is quite high but the product is worth it ,Negative,Positive,,,
2373.0,staff is also very friendly,,,,Positive,
2374.0,paratha are really damn heavy    can fill an average man ,,Positive,,,
2374.0,but are too spicy   ,,Negative,,,
2375.0,a decent punjabi food place ,,Neutral,,,
2375.0,awesome food and nice ambience ,,Positive,Positive,,
2375.0,the packaging is superb  ,,,,Positive,
2375.0,another must visit place for punjabi food lovers ,,Positive,,,
2375.0,variety of options to try ,,Positive,,,
2376.0,the best brownie i had till date ,,Positive,,,
2376.0,it s not like those regular brownies ,,Positive,,,
2376.0,it has a different taste and softness ,,Neutral,,,
2376.0,but nothing can beat their brownies ,,Positive,,,
2376.0,very fancy packaging ,,,,Positive,
2376.0,perfect to gift someone,,,,,Positive
2377.0,great food ,,Positive,,,
2377.0,though options in menu can be increased ,,Negative,,,
2377.0,pricing is decent with great taste and good service ,Neutral,Positive,,Positive,
2377.0,polite staff ,,,,Positive,
2377.0,add more option in menu ,Negative,,,,
2378.0,the restaurant recive order politly  ,,,,Positive,
2378.0,quamntity and quality is good  ,,Positive,,,
2378.0,price is also readonable  ,Positive,,,,
2378.0,many items with good taste ,,Positive,,,
2378.0,and less price  ,Positive,,,,
2379.0,nice place  good location   descent ambience   and very good service by sahoo ,,,Positive,Positive,
2379.0,had a descent time with friends ,,,,,Positive
2379.0,will surely come back again               ,,,,,Positive
2380.0,i didn t try too many things from here but chicken dum biryani was good ,,Positive,,,
2380.0,quantity was very good if you are a single person then it is too much and for two people it s not very enough you would need to get a shake or something with it ,,Positive,,,
2380.0,it s not like you will be hungry but you won t be full till neck that s how i like eating biryani  ,,Positive,,,
2380.0,if two persons are just normal eater then it s a win win ,,Positive,,,
2381.0,food  the food was quite delicious ,,Positive,,,
2381.0,i ordered oregano fish tikka  which was really nice ,,Positive,,,
2381.0,i had also ordered egg spring rolls which were very tasty but i felt they could be crispier ,,Positive,,,
2381.0,for main course  i had plain naan and dum ka murgh which went really well with the naan ,,Positive,,,
2381.0,service  staff was very corteous and polite and very attentive ,,,,Positive,
2381.0,plates were changed and food was continually served ,,,,Positive,
2381.0,also they support amex  which was quite nice as i am unable to use my cc at a lot of restaurants ,Positive,,,,
2381.0,ambience  this is a nice place to come with family or group of friends ,,,Positive,,
2381.0,it is not very fancy but they have a private hall as well so if you re looking for a closed off area to dine  you have that option ,,,Positive,,
2382.0,good north indian food ,,Positive,,,
2382.0,the food is good ,,Positive,,,
2383.0,surprisingly  it was quiet ,,,Positive,,
2383.0,but loved the ambiance  ,,,Positive,,
2383.0,it s quite spacious ,,,Positive,,
2383.0,had it been a lil more crowded  i d have given   s overall  thumbs up ,,,Neutral,,
2384.0,great place to have lunch or dinner with a group ,,,,,Positive
2384.0,great atmosphere and you get a feeling of being close to nature  as everything has a tribal like theme ,,,Positive,,
2384.0,also  indoor seating is available  but the outdoor one is the real deal here ,,,Positive,,
2384.0,though the food is pretty much average  nothing great ,,Neutral,,,
2384.0,do note that waiting times are huge  and it s better for groups than just     people ,,,,Negative,
2385.0,there is no separate entrance to the bar directly which means that you have to pass all the people in the mall with your party wear ,,,Negative,,
2385.0,you may find it little bit awkward ,,,,,Negative
