id,restaurant_id,restaurant_name,sentence,id_sentence
186,2,Gate Of India,saying they food and flavours were even average would be an exaggeration,587
186,2,Gate Of India,they service could have been more professional,588
186,2,Gate Of India,wish them best of luck if they embark on a journey of improvement,589
187,2,Gate Of India,ordered takeout there was no salt on they garlic naan bread or on they chicken nikki marsala,590
187,2,Gate Of India,i ordered they chicken tina marsala with medium spice there was absolutely no spice at all,591
187,2,Gate Of India,they chicken was dry and chewy they bread was also hard to chew,592
187,2,Gate Of India,expensive prices for low quality food,593
188,2,Gate Of India,really bad experience they disappointed me i ordered chicken manchurian but they gave me chilli chicken,594
188,2,Gate Of India,they really turns my excitement into disappointment just waste of money and time,595
189,2,Gate Of India,i would like to tell you that their food is wonderful but i never got it,596
189,2,Gate Of India,i ordered my food at two fifty,597
189,2,Gate Of India,i called at five pm because i still had not received it they told me that they food suppose to arrive within fifteen minutes,598
189,2,Gate Of India,at six pm i still could not see any sing of my food so i cancelled my order,599
190,2,Gate Of India,calling this indian food is blasphemy,600
190,2,Gate Of India,they serve maggie in they name of hakka noodles and they food lacks flavor,601
191,2,Gate Of India,they food is really so bad no taste at all i ordered online and i am very disappointed with this they vegetable bryan taste like sweet rice and i ordered noodles they gave me maggie seriously i have to spend money on this if i need maggie i would make it my own seriously it is so bad,602
192,2,Gate Of India,ordered takeout six pm estimated delivery time was seven ten pm,603
192,2,Gate Of India,i called at seven fort pm and they said it was out for delivery and should arrive soon,604
192,2,Gate Of India,eight pm they cancel they order,605
192,2,Gate Of India,when i call them they said there was traffic so they cancelled they order,606
192,2,Gate Of India,this makes no sense because supposedly they already cooked my food and spent what they said fifty in in traffic,607
192,2,Gate Of India,not only did they lose they sale but they earned one star reviews on every platform for wasting two hours of my time,608
192,2,Gate Of India,so unprofessional of them if they did not want to deliver then they should have cancelled shortly after receiving it not two hours later,609
193,2,Gate Of India,believe they bad reviews this food was horrible,610
194,2,Gate Of India,they served maggie in they name of vegetarian hakka noodles,611
194,2,Gate Of India,disgusting food,612
194,2,Gate Of India,shame in they name of indian cuisine,613
194,2,Gate Of India,they should stop serving food,614
195,2,Gate Of India,this place is incredible,615
195,2,Gate Of India,my go to comfort food,616
195,2,Gate Of India,always super fast service,617
195,2,Gate Of India,you can tell they really care about they food and packaging,618
195,2,Gate Of India,do wish they used less plastic though,619
195,2,Gate Of India,highly recommend,620
196,2,Gate Of India,they coconut curry is they best i be ever had,621
196,2,Gate Of India,garlic naan is awesome lamb samosas are fire ten ten,622
197,2,Gate Of India,amazing service and high quality vegan food,623
197,2,Gate Of India,they owner is a blessing,624
197,2,Gate Of India,thank you so much,625
198,2,Gate Of India,i asked for one on one free naan that did not deliver it,626
198,2,Gate Of India,i request for some condiments i did not receive it,627
199,2,Gate Of India,terrible food wasted one hundred worst bryan i have ever tasted,628
200,2,Gate Of India,really good food and quick service,629
200,2,Gate Of India,must visit for indian food,630
201,2,Gate Of India,definitely recommend these guys best in town,631
202,2,Gate Of India,very good,632
202,2,Gate Of India,cannot wait to come back,633
203,2,Gate Of India,amazing and delicious vegan food,634
204,2,Gate Of India,amazing food and amazing ambiance,636
205,2,Gate Of India,very bad behaviour of staff do not come here,637
